ID	Sentence	Detected as	Resolved as
space#11	For hardware exceptions and reserved exceptions, the FTSS shall make the error type and <referential>its</referential> context data available to the application, then return from the exception handler to the task that was running when the exception occurred.	NOCUOUS	
space#12	Messages are addressed with a global unique communication identifier that routes <referential>them</referential> to the appropriate virtual group (VG) and socket.	INNOCUOUS	Messages
space#13	This restriction does NOT apply to the ICPs since <referential>they</referential> are running as simplex VGs.	INNOCUOUS	ICPs
space#14	The FTSS shall mask out a babbling NE or ICP within 40 milliseconds after <referential>it</referential> is detected.	NOCUOUS	
space#15	Synchronous message passing sockets shall queue outgoing messages until <referential>they</referential> are transmitted at frame boundaries.	NOCUOUS	
space#16	Pipes may be opened by multiple receiving tasks if <referential>they</referential> are created with the broadcast" capability; otherwise <referential>they</referential> may only be opened by one receiving task."	NOCUOUS	
space#17	Communication services shall provide the capability to create pipe"s which "broadcast" <referential>their</referential> messages to all virtual groups."	NOCUOUS	
space#18	If the broadcast option is used, each virtual group should open the pipe and read from <referential>it</referential> to avoid flow control problems.	NOCUOUS	
space#19	The application software shall have the capability to reset a permanently failed channel to <referential>its</referential> initial recovery state.	NOCUOUS	
space#20	Redundancy Management picks up where <referential>it</referential> left off in these attempts.	INNOCUOUS	Redundancy management		
